Tweet,Target,Stance,Opinion Towards,Sentiment,Tweet Id
"Young people are dying in schools, please close those doors.",school_closures,FAVOR,"1.  The tweet explicitly expresses opinion about the target, a part of the target, or an aspect of the target.",neg,1283372061688299522
"@RepRalphNorman @grahamblog @SenatorTimScott  @scsenategop #coronavirus #southcarolina
Close the schools!",school_closures,FAVOR,"1.  The tweet explicitly expresses opinion about the target, a part of the target, or an aspect of the target.",neg,1237628142203867136
In case anyone is wondering my children will not be attending public schools in the fall. #COVID19 #schoolviolence #sexualharassment #SystemicRacism  #bullying #TeachersLivesMatter #SocialInjustice need more reasons? #backtoschool,school_closures,FAVOR,"1.  The tweet explicitly expresses opinion about the target, a part of the target, or an aspect of the target.",neg,1284279205388328960
"Like what are we going to do if we get it, is there a cure for coronavirus? no. cancel school. We don’t want more children getting sick. @ScottMorrisonMP #Coronavid19 #coronavirus #coronavirusaustralia #Covid_19australia",school_closures,FAVOR,"1.  The tweet explicitly expresses opinion about the target, a part of the target, or an aspect of the target.",neg,1241733782249435136
"@AprilDRyan My son has asthma and I have multiple autoimmune problems so we decided online was the way to go. A couple of weeks later @CobbSchools agreed that everyone should attend online. I for one commend them for it. It won't be easy but it is necessary!
#Schools",school_closures,FAVOR,"1.  The tweet explicitly expresses opinion about the target, a part of the target, or an aspect of the target.",pos,1286720512022937602
"tRUmpublicans think it's OK to rape, cage, starve, gun-down or expose our children to a deadly pandemic but lose their shit about abortion.  ",school_closures,FAVOR,2. The tweet does NOT expresses opinion about the target but it HAS opinion about something or someone other than the target.,neg,1282695829644607490
"@redfreedom2020 @donwinslow Taught 30 years. I can tell you that schools are a Petri dish for germs. Kids don’t follow/understand hygiene standards like adults do, and they constantly touch one another. Normally our bodies fight it off. Not with Covid.",school_closures,FAVOR,"1.  The tweet explicitly expresses opinion about the target, a part of the target, or an aspect of the target.",neg,1284113522985783303
we request our respected Prime Minister  @ImranKhanPTI and our education minister @Shafqat_Mahmood to announce opening of schools after Eid.,school_closures,FAVOR,"1.  The tweet explicitly expresses opinion about the target, a part of the target, or an aspect of the target.",pos,1284808700402819072
I don’t care about the coronavirus I just want to get out of this my dumbass school lmao,school_closures,FAVOR,"1.  The tweet explicitly expresses opinion about the target, a part of the target, or an aspect of the target.",neg,1237544119452323841
Teachers put in a lot of effort to conduct online class. Listen to the teacher and it's a good mode of education in the current scenario. How do we expect schools to pay them without any fees.  #SaveOurSchools,school_closures,FAVOR,"1.  The tweet explicitly expresses opinion about the target, a part of the target, or an aspect of the target.",pos,1287317651828613120
"We must boycott our schools, and protest to have the schools shut down, due to coronavirus. It's not only threatening to us as students, but to our parents. PEOPLE WHO THINK THAT THIS SITUATION ISN'T AS BAD AS IT SEEMS, YOU ARE DELUSIONAL AS FUCK!",school_closures,FAVOR,"1.  The tweet explicitly expresses opinion about the target, a part of the target, or an aspect of the target.",neg,1237492644860887043
"@apiper13 @nowthisnews Schools aren't ready.I know when my children get sick i always quarantined them in rooms.Yet I still get it We knw It goes thru the household maybe kids are more ASymptomatic for now until it mutates again &amp; Give it to Others, Teachers,Staff it'll spreads over &amp; over.",school_closures,FAVOR,"1.  The tweet explicitly expresses opinion about the target, a part of the target, or an aspect of the target.",neg,1286700186149019648
@MSNBC All countries in the western world opening schools but let's see..we don't follow the science to open schools but we followed science to shut down..oh ok now that makes sense.,school_closures,FAVOR,"1.  The tweet explicitly expresses opinion about the target, a part of the target, or an aspect of the target.",neg,1283851972546826241
"Are we going to allow our kids to be vectors of the #coronavirus and pass it to Grandma and grandpa?

Don't hate the elderly.",school_closures,FAVOR,"1.  The tweet explicitly expresses opinion about the target, a part of the target, or an aspect of the target.",neg,1237647104245465088
"When trump says,""You don't have to wear a mask.""
I'm wearing a mask.
When trump says""Covid is a hoax.""
I know it's real.
When trump says""Beaches,bars &amp;casinos must open.""
I'm staying home. 
When trump insists,""Children should go to school,"" during a pandemic.
I shout",school_closures,FAVOR,"1.  The tweet explicitly expresses opinion about the target, a part of the target, or an aspect of the target.",neg,1283992258275155968
"What's more important? A students education? Or the wellness of the student and staff? Closing schools for a day may work for bad weather, but not for the coronavirus. Districts all around need to open their eyes and realize one day closures do nothing to help!",school_closures,FAVOR,"1.  The tweet explicitly expresses opinion about the target, a part of the target, or an aspect of the target.",neg,1237551659728814082
Just close the schools and promote each and every learner i mean this education system is all about producing factory faults.,school_closures,FAVOR,"1.  The tweet explicitly expresses opinion about the target, a part of the target, or an aspect of the target.",neg,1283296827937361921
"Grown ass people are constantly throwing temper tantrums over wearing a mask to grocery shop for 30 mins, but kids, especially non neurotypical kids, can absolutely wear a mask for 7 hours a day to go back to school while the politician's kids stay home.",school_closures,FAVOR,"1.  The tweet explicitly expresses opinion about the target, a part of the target, or an aspect of the target.",neg,1286817098958802948
I just don't understand why schools are opening and the outbreak is getting worse.,school_closures,FAVOR,"1.  The tweet explicitly expresses opinion about the target, a part of the target, or an aspect of the target.",neg,1286511409682055168
"There isn’t a child on this planet who would social distance and wear a mask for SIX hours a day, 5 days a week.",school_closures,FAVOR,"1.  The tweet explicitly expresses opinion about the target, a part of the target, or an aspect of the target.",neg,1283821857477713925
Y'all have the highest school shooters numbers and the highest #COVID19 numbers but y'all want kids to go back to school.,school_closures,FAVOR,"1.  The tweet explicitly expresses opinion about the target, a part of the target, or an aspect of the target.",neg,1283925496061992961
Schools have taken a lot of effort in setting up the online classes. It's a new era of the digital world and we need to support it and not spoil it.,school_closures,FAVOR,"1.  The tweet explicitly expresses opinion about the target, a part of the target, or an aspect of the target.",pos,1287428233076412416
"My first online class was over Skype and the first 30mins was watching a classmate document himself cooking eggs. All in all a 10/10 experience
#coronavirus #StayAtHome",school_closures,FAVOR,"1.  The tweet explicitly expresses opinion about the target, a part of the target, or an aspect of the target.",pos,1239544897096634369
Teachers to teach our kids.  They protect them from active shooters.  Now we're asking them to risk their lives/health to free us up to go to work?  Completely crazy.  All teachers should quit if their county forces them to teach in-person. #SchoolReopening,school_closures,FAVOR,"1.  The tweet explicitly expresses opinion about the target, a part of the target, or an aspect of the target.",neg,1283425014306557952
@JoshuaPotash @thegoodgodabove The way we'll know if @GOP really thinks it will be safe to go back to classrooms will be if they gut OSHA provisions for Workers Compensation if employees contract work related COVID19 illnesses. That would be a strike-worthy issue. #coronavirus,school_closures,FAVOR,"1.  The tweet explicitly expresses opinion about the target, a part of the target, or an aspect of the target.",neg,1283931098637111298
"Now Cohen is getting released. Just so we keep the record straight I’d like to remind everyone Covid-19 has made prisons so dangerous that Manafort, Stone, and Cohen are not incarcerated. Meanwhile President Ding Dong is lobbying for kids to be in school.",school_closures,FAVOR,"1.  The tweet explicitly expresses opinion about the target, a part of the target, or an aspect of the target.",neg,1287482231687008256
"What’s wrong with the corona virus. People are stocking up for an apocalypse and it’s stupid. Calm down, it’s literally a worse real story flu and why are people having a seizure over this. I’m acting like it doesn’t exist. But close the schools please",school_closures,FAVOR,"1.  The tweet explicitly expresses opinion about the target, a part of the target, or an aspect of the target.",neg,1237551776083009536
"9/ Bottom line: If we value Black and Latinx lives, we should only open schools if it’s 100% safe to do so. 

Facts are facts.",school_closures,FAVOR,"1.  The tweet explicitly expresses opinion about the target, a part of the target, or an aspect of the target.",other,1284498474474573863
"It my opinion schools should stay closed not just cusse of corona 
",school_closures,FAVOR,"1.  The tweet explicitly expresses opinion about the target, a part of the target, or an aspect of the target.",other,1282708509533057025
"@MollyJongFast Children are not allowed in school if they have a contagious disease. 
Letters are sent home informing parents. Just in case.
Asymptomatic covid
Could quickly infect the entire school. Then the community.
It is foolish to contemplate opening until testing is in place.",school_closures,FAVOR,"1.  The tweet explicitly expresses opinion about the target, a part of the target, or an aspect of the target.",neg,1281183442970034176
@richardmarx It makes 0 sense that we send kids back to school when we still need to mask up and distance everywhere else.,school_closures,FAVOR,"1.  The tweet explicitly expresses opinion about the target, a part of the target, or an aspect of the target.",neg,1284977808838623232
"@CDCDirector Bullshit
When @SenRickScott and @realDonaldTrump send their kids and grandkids back to school instead of distance learning? Then let's  talk ...
#teacherproblems #COVIDIDIOTS #COVID19 #ReopenSchools #teacherlivesmatter #StudentsLivesMatters #distancelearning",school_closures,FAVOR,"1.  The tweet explicitly expresses opinion about the target, a part of the target, or an aspect of the target.",neg,1287621564163223553
"@GOP We are fine with opening schools with a PLAN, mandatory masks, contact tracing, onsite testing with same day results, required social distancing. PPE for teachers, staff, janitors, etc. It requires MONEY and the do-nothing GOP will provide none of that.",school_closures,FAVOR,2. The tweet does NOT expresses opinion about the target but it HAS opinion about something or someone other than the target.,neg,1284548918798192640
"@kurteichenwald Do not take the excuse that it's the school's decision and it's a private school. Believe that 45 should be putting pressure on his son's school to open just like he's putting pressure on public schools.

I don't care what schools open. Mine is going virtually.",school_closures,FAVOR,"1.  The tweet explicitly expresses opinion about the target, a part of the target, or an aspect of the target.",neg,1286770826524553217
"This is tiring, those parents who says kids are safe at schools should just bring them once, and hope their funeral covers and policies are up to date...mine will be at home!!!",school_closures,FAVOR,"1.  The tweet explicitly expresses opinion about the target, a part of the target, or an aspect of the target.",neg,1283400716195901440
"#PostponeJEE_NEETinCovid
We Wont give exams until our parliament is closed and until there is no vaccine. As WHO says covid has become airborne and can travel upto 15 feet, so socil distancing will be a joke at the examination centres.teenagers are at higher risk",school_closures,FAVOR,"1.  The tweet explicitly expresses opinion about the target, a part of the target, or an aspect of the target.",neg,1287335380740530176
"Don’t Experiment on our kids @GovTimWalz! Open Schools, Op Minnesota!",school_closures,FAVOR,"1.  The tweet explicitly expresses opinion about the target, a part of the target, or an aspect of the target.",neg,1284194703571918848
Children can't maintain social distancing!,school_closures,FAVOR,2. The tweet does NOT expresses opinion about the target but it HAS opinion about something or someone other than the target.,other,1282712020391993345
I've made a big discussion today and that my 3 children will not be going back to school until the #coronavirus is under control or there is a vaccination for it....,school_closures,FAVOR,"1.  The tweet explicitly expresses opinion about the target, a part of the target, or an aspect of the target.",other,1237836066100580353
"Reopening schools this fall as if everything is normal is stupid.  Students, teachers and staff are worth protecting.  Im not willing to send my kids into harms way for trumps ego.",school_closures,FAVOR,"1.  The tweet explicitly expresses opinion about the target, a part of the target, or an aspect of the target.",neg,1283834190371274753
"Parents have the power, by simply pulling all your kids out of school, all schools will shut down!",school_closures,FAVOR,"1.  The tweet explicitly expresses opinion about the target, a part of the target, or an aspect of the target.",pos,1283304917122375680
"Schools should just be closed,the 2020 curriculum will continue once the vaccine is found,even if it means 2020 curriculum get done in 2021-2022,we’ll have to adjust &amp; catch-up at some point.",school_closures,FAVOR,"1.  The tweet explicitly expresses opinion about the target, a part of the target, or an aspect of the target.",pos,1283301001504727040
"@therecount Sending children to school during a deadly #COVID19 pandemic,
is worse than putting your children in cars without seatbelts. 
It's playing Russian Roulette with the lives of children. 

It's child abuse. 

#StayHome",school_closures,FAVOR,"1.  The tweet explicitly expresses opinion about the target, a part of the target, or an aspect of the target.",neg,1286775067196534785
"We know we can’t open schools safe 138,000 people dead from a virus our government failed to protect us from @BetsyDeVosED SCREW OFF",school_closures,FAVOR,"1.  The tweet explicitly expresses opinion about the target, a part of the target, or an aspect of the target.",neg,1283878338482843649
"@ossoff Well, the reopening of schools should go smoothly. I was told that anyone with a fever can return to school 24 hours after it breaks. There’s no testing, not even a doctor’s note required for staff and students to return. 

#NotMyKid",school_closures,FAVOR,"1.  The tweet explicitly expresses opinion about the target, a part of the target, or an aspect of the target.",neg,1287366337589895168
4) We as Sadtu want schools to close because psychosocial services that is needed now urgently to mitigate against the anxiety has not been effected as earlier commited by the Minister,school_closures,FAVOR,"1.  The tweet explicitly expresses opinion about the target, a part of the target, or an aspect of the target.",pos,1283696390292602880
My family is living in fear because my brother is going to college with two staff members who interacted with someone who passed away due to the coronavirus. And yet they won't close the school? Why? Don't you want to protect the students?,school_closures,FAVOR,"1.  The tweet explicitly expresses opinion about the target, a part of the target, or an aspect of the target.",neg,1237517886404452352
I’m homeschooling this year. Not risking my daughter over someone who doesn’t understand wind and thinks the enemy is a friend.,school_closures,FAVOR,"1.  The tweet explicitly expresses opinion about the target, a part of the target, or an aspect of the target.",other,1283821165283344386
"And yes, I've decided to homeschool &amp; I know that's not an option for everyone, but it's very blasé to say ""Just keep your kid home"" because those kids &amp; teachers will be spreading it to their families &amp; others &amp; into the community. Reopening schools is a big mistake.",school_closures,FAVOR,"1.  The tweet explicitly expresses opinion about the target, a part of the target, or an aspect of the target.",neg,1286818164714754048
I’m absolutely scared silly about this coronavirus. I want to batten down the hatches and keep my babies home till it blows over #COVID2019uk,school_closures,FAVOR,"1.  The tweet explicitly expresses opinion about the target, a part of the target, or an aspect of the target.",neg,1237511368653205504
"@donwinslow Even though my 4 kids are adults, our oldest is a teacher. There is absolutely no guidance in place now. Schools open in less than a month. I worry about her and her students.",school_closures,FAVOR,"1.  The tweet explicitly expresses opinion about the target, a part of the target, or an aspect of the target.",other,1284060364460589059
"If #NYCSchools reopen before #COVID19 is under control, then assuming the .1% fatality rate is correct for children, ages 4-18, then the death rate of students in #NYC will be 1,127 (rounded) based on current enrollment.

#Coronavirus #CoronavirusPandemic",school_closures,FAVOR,"1.  The tweet explicitly expresses opinion about the target, a part of the target, or an aspect of the target.",neg,1283899431180476417
"Sooo..
#COVID19 is so contagious we release inmates from prison...but safe enough that we can send our children back to school. 
Dangerous enough that we're still on lockdown. But safe enough to jeopardize the lives of our babies? 
#IRefuse
#SendBaron",school_closures,FAVOR,"1.  The tweet explicitly expresses opinion about the target, a part of the target, or an aspect of the target.",neg,1285927826194141184
Donald Trump could stand in the middle of Fifth Avenue and kill a million schoolchildren via #COVID19 and not lose any #MAGA voters..,school_closures,FAVOR,"1.  The tweet explicitly expresses opinion about the target, a part of the target, or an aspect of the target.",neg,1283867072636702720
@T_R_0_V_3_R @repairrestores1 We all know that opening schools during a raging killer pandemic is criminal and crazy.,school_closures,FAVOR,"1.  The tweet explicitly expresses opinion about the target, a part of the target, or an aspect of the target.",neg,1284253925961433088
"@SpeakerRyan Paul Ryan, millionaire white Republican, has 3 kids: Liza Ryan, 18, Charles, 17, and Samuel Ryan, 15.

I wonder if he will be sending them to school in a few weeks. He’s made no statement condemning the decision by his party to reopen schools. #GOPkids #notmykid",school_closures,FAVOR,"1.  The tweet explicitly expresses opinion about the target, a part of the target, or an aspect of the target.",neg,1284514555071287298
Homeschooling is the best way ever!,school_closures,FAVOR,"1.  The tweet explicitly expresses opinion about the target, a part of the target, or an aspect of the target.",pos,1283815864094150657
The question is not whether NYC schools will shut down. They will. For sure. The questions is how many #coronavirus cases do we need to get to for our leaders to decide to close them. @BilldeBlasio @NYGovCuomo,school_closures,FAVOR,"1.  The tweet explicitly expresses opinion about the target, a part of the target, or an aspect of the target.",neg,1239059138363228161
@MegaRacismHater @AdamSchefter Good. The whole league should do the same ... keep the schools closed too!,school_closures,FAVOR,"1.  The tweet explicitly expresses opinion about the target, a part of the target, or an aspect of the target.",pos,1284265873130360833
@GaHospitalAssoc @GaDPH @GovKemp Better yet #StayHomeSaveLives #ShutGADown,school_closures,FAVOR,2. The tweet does NOT expresses opinion about the target but it HAS opinion about something or someone other than the target.,pos,1286035305460641794
@TelanganaToday can you please look after schools which are not closing even after the government orders. Kangaroo kids begumpet and chirec are still working for teachers.Please seal the schools. #coronavirus #telanganatoday,school_closures,FAVOR,"1.  The tweet explicitly expresses opinion about the target, a part of the target, or an aspect of the target.",other,1240264925072613376
I am a parent. And a bad teacher. And I am anxious about schools in fall. #schoolsreopening #pandemic #SchoolReopening,school_closures,FAVOR,"1.  The tweet explicitly expresses opinion about the target, a part of the target, or an aspect of the target.",neg,1285249385669025792
D'ya know why Trump has a boner about opening schools? So parents go back to work &amp; he can claim a revitalized economy for election. Trump is willing to bet your kids lives to WIN An Election.,school_closures,FAVOR,"1.  The tweet explicitly expresses opinion about the target, a part of the target, or an aspect of the target.",neg,1284585812324220932
"@TeaPainUSA I think the kids who get COVID-19 at school should go to @GovParsonMO's home until they get over it. 

#COVIDIOTS 
#ProtectOurKids",school_closures,FAVOR,"1.  The tweet explicitly expresses opinion about the target, a part of the target, or an aspect of the target.",neg,1285226382860210176
Everyone is worried for the students but don’t forget about teachers too! Most teachers are of an older age which leaves them more vulnerable to COVID-19,school_closures,FAVOR,2. The tweet does NOT expresses opinion about the target but it HAS opinion about something or someone other than the target.,other,1282697709082882048
Schools will perfectly help me spread. - The Virus:microbe:,school_closures,FAVOR,"1.  The tweet explicitly expresses opinion about the target, a part of the target, or an aspect of the target.",neg,1283940192525725696
I didn’t realize DT maliciously hid the CDC recommendationthat NO SCHOOLS should open. How can anyone in education ignore experts? Hoping school districts send a clear message to politicians NOT to play politics w/our children. This is not a good experiment.,school_closures,FAVOR,"1.  The tweet explicitly expresses opinion about the target, a part of the target, or an aspect of the target.",neg,1286844849950523393
@CDCgov  no longer gets data. It goes to the White House. Great. The country we relied on to keep us safe and that said the virus is a hoax. Now has contol over the numbers we see. And he wants schools open,school_closures,FAVOR,"1.  The tweet explicitly expresses opinion about the target, a part of the target, or an aspect of the target.",neg,1283806292340072448
"Ya know, people always say that “the children are our future”. Then bitch, why are you sending your future into the most dangerous place to be during a global pandemic?? choices. ",school_closures,FAVOR,"1.  The tweet explicitly expresses opinion about the target, a part of the target, or an aspect of the target.",neg,1282702637855637504
"You must close the schools for a period of time corona virus infected many people, do it now u don’t want to be like Italy",school_closures,FAVOR,"1.  The tweet explicitly expresses opinion about the target, a part of the target, or an aspect of the target.",other,1237542444259917824
"@DWUhlfelderLaw Yes!!  Thank you!  I’m a Florida mom and friend to many teachers who are scared to death.
@GovRonDeSantis is a freaking idiot, a dangerously negligent and incompetent idiot!",school_closures,FAVOR,"1.  The tweet explicitly expresses opinion about the target, a part of the target, or an aspect of the target.",neg,1285238635693051904
We have to wait for somebody to actually get the coronavirus in our school for us to close? Shouldn't we be closing the schools to prevent the spread of this?are schools that desperate for money to the point that they will wait for somebody to get infected?,school_closures,FAVOR,"1.  The tweet explicitly expresses opinion about the target, a part of the target, or an aspect of the target.",neg,1237522364155346944
Who is Angie Motshega if @WHO has said it is not safe for schools to reopen during the spike of the pandemic. Parents let's not take our kids to schools WITH IMMEDIATE EFFECT,school_closures,FAVOR,"1.  The tweet explicitly expresses opinion about the target, a part of the target, or an aspect of the target.",neg,1283317856403427328
"Either you win by dismantling the corrupt school system, or you win when the science is all of a sudden on your side and its ok to open schools. What do you think sir?

#homeschool",school_closures,FAVOR,"1.  The tweet explicitly expresses opinion about the target, a part of the target, or an aspect of the target.",neg,1284111478308712450
