Tweet,Target,Stance,Opinion Towards,Sentiment,Tweet Id
"There are way more people with coronavirus than we know about. We should be cautious, but it is already in the community.  We need to mitigate and so some serious social distancing starting yesterday. Because...hello #italy",school_closures,NONE,2. The tweet does NOT expresses opinion about the target but it HAS opinion about something or someone other than the target.,neg,1237509971887128576
I was thinking schools and teachers will be rewarded for their tremendous efforts after coming out from  Covid 19 problem but the advisors of Govt think differently. @imBhupendrasinh @vijayrupanibjp @CMOGuj,school_closures,NONE,2. The tweet does NOT expresses opinion about the target but it HAS opinion about something or someone other than the target.,neg,1287315256218288128
"The Yoyogi district, the main stadium for the Olympics, is close to Korean Town in Okubo.  Care must be taken when considering the effects of the coronavirus.
#Olympics2020 
#olympicscorona
#coronavirus 
#CoronaOutbreak 
#japan
#COVID2019uk",school_closures,NONE,2. The tweet does NOT expresses opinion about the target but it HAS opinion about something or someone other than the target.,neg,1237696778100563970
just thinking abt how homeschooling is legal in all 50 U.S. states &amp; there are homeschooling support groups all over the place &amp; secular homeschooling is also a thing if you so desire,school_closures,NONE,2. The tweet does NOT expresses opinion about the target but it HAS opinion about something or someone other than the target.,pos,1283827931295424512
"Only a week ago I still believed COVID-19 is just another flu-like infection and people should stop panicking just because it's in the news. Each day I realise more that this was only a tactic to keep people calm, which I agree is important. Now stop wasting time",school_closures,NONE,2. The tweet does NOT expresses opinion about the target but it HAS opinion about something or someone other than the target.,neg,1237609412631527426
"T-97 @___AmanYadav 
Why do private schools go to the High Court to seek justice? We don't want to spend the Court's precious time as you are our people representatives. Listen to our voice. We want to trust you. We want you to think holistically &amp; teacher in mind.",school_closures,NONE,2. The tweet does NOT expresses opinion about the target but it HAS opinion about something or someone other than the target.,other,1287408209649496064
"Which other sector has been banned from providing services or collecting revenue? 
So liquor shops, malls, all were poor hand-to-mouth and show must go on for them; while all schools have been doing is exploit parents! Is that how schools have been perceived",school_closures,NONE,2. The tweet does NOT expresses opinion about the target but it HAS opinion about something or someone other than the target.,neg,1287346807723319297
"@JeffreyGuterman Go home and spread it to their parents, siblings, grandparents, neighbors, friends...  That’s obviously ok with this #COVIDIOTS #WearADamnMask",school_closures,NONE,2. The tweet does NOT expresses opinion about the target but it HAS opinion about something or someone other than the target.,neg,1285272109095116800
"Across India, a whole spectrum of parents and the government have taken to systematic outrage and criticising of school's charging fees in the lockdown period. They say the phones, laptops and broadband charges are expensive and unnecessary.",school_closures,NONE,2. The tweet does NOT expresses opinion about the target but it HAS opinion about something or someone other than the target.,neg,1287363764128329728
"@MysterySolvent The Picture of Orangian Gray

#CoronavirusPandemic #Covid_19 
#CoronaOutbreak #coronavirus #StockMarket #marketcrash #marketcrash",school_closures,NONE,"3.  The tweet is not explicitly expressing opinion. (For example, the tweet is simply giving information.)",other,1238349240046424064
"@ReginahMhaule @DBE_SA 
The @CyrilRamaphosa announcement that public school will close means that private schools remain open? Theoretically yes, is the ministry saying that there's no #COVID19 in private schools?
#schools",school_closures,NONE,"3.  The tweet is not explicitly expressing opinion. (For example, the tweet is simply giving information.)",neg,1286542976517316608
"@Akanksha_1009 Save schools, Save Teachers and Save the Students!!! #tweetstrom",school_closures,NONE,2. The tweet does NOT expresses opinion about the target but it HAS opinion about something or someone other than the target.,pos,1287384114950070274
"#7 “We’re all going to get the coronavirus eventually, so what’s the difference?”
:bulb:Mortality will be much higher if millions get it all at once, before health systems have the time to build up capacity to respond.",school_closures,NONE,2. The tweet does NOT expresses opinion about the target but it HAS opinion about something or someone other than the target.,neg,1236875545536684032
"Time is passing,the Coronavirus is not!#CUNY",school_closures,NONE,"3.  The tweet is not explicitly expressing opinion. (For example, the tweet is simply giving information.)",other,1237486097434894336
"Anyone who would strap a mask on their child's face for 5 minutes let alone 7 hours should be jailed for child abuse.  

Any Dr. who recommends putting a mask on a child should be stripped of their medical license - at the minimum.",school_closures,NONE,2. The tweet does NOT expresses opinion about the target but it HAS opinion about something or someone other than the target.,neg,1283813016224423936
Regardless if a teacher gets Coronavirus the government are still stating ONLY if you come back from an infected country are you allowed to self quarantine or you will not get paid ARE WE NOT A FUCKIN INFECTED COUNTRY?? #COVID2019uk #coronavirus #coronavirusuk,school_closures,NONE,2. The tweet does NOT expresses opinion about the target but it HAS opinion about something or someone other than the target.,neg,1237611874583076874
"I would like to hear from other parents about schools reopening. Amie is 16, she has flat out told me she won't go back until a vaccine exists. #COVID19 ",school_closures,NONE,"3.  The tweet is not explicitly expressing opinion. (For example, the tweet is simply giving information.)",other,1282694458178506753
Extending our support to #SaveOurSchools Campaign for protecting rights and interests of schools and teachers. @act_cmt stands strong with Pvt School Fraternity.,school_closures,NONE,2. The tweet does NOT expresses opinion about the target but it HAS opinion about something or someone other than the target.,pos,1287382050677325824
@RepValDemings But...but...but you said masks prevent everything!  All wear masks and,school_closures,NONE,2. The tweet does NOT expresses opinion about the target but it HAS opinion about something or someone other than the target.,neg,1281223516638019586
"@DonaldJTrumpJr 

If a healthy person is diagnosed with #coronavirus and dies from any other cause, like hit by a bus or anything, our state government counts that as a #Covid19 death. 

These numbers are so damn flawed. 

Very frustrating. 

#GOP",school_closures,NONE,2. The tweet does NOT expresses opinion about the target but it HAS opinion about something or someone other than the target.,neg,1283732591615639552
The body running its own schools cannot be the body regulating other schools.,school_closures,NONE,2. The tweet does NOT expresses opinion about the target but it HAS opinion about something or someone other than the target.,neg,1287364067347189763
"@robreiner With the help of the Republican Party!
#TrumpVirus",school_closures,NONE,2. The tweet does NOT expresses opinion about the target but it HAS opinion about something or someone other than the target.,neg,1283934499953246213
"Share your thoughts &amp; type #SaveOurSchools in your tweet today between 2 pm and 6 pm for our Schools, Children, Parents &amp; Teachers in #Gujarat

:sos:RETWEET!! RETWEET!! RETWEET!! RETWEET!! :sos:

#SaveOurSchools 
#SaveOurSchools 
#SaveOurSchools 
#SaveOurSchools",school_closures,NONE,2. The tweet does NOT expresses opinion about the target but it HAS opinion about something or someone other than the target.,pos,1287240824569372672
"Every time you point a finger on others —there are three remaining fingers pointing right back at you.” @narendramodi @DrRPNishank @rashtrapatibhvn Reform the government schools where there is a need, don't put your energy in regulating private schools.",school_closures,NONE,2. The tweet does NOT expresses opinion about the target but it HAS opinion about something or someone other than the target.,neg,1287368940096614400
So many schools in Indian are being closed for the #COVID19 but not my sisters school district. I had the H1N1 and my mom didnt think is was a big deal and decided to not get me a shot. Sh regretted it after I got ill and had to go to the hospital.,school_closures,NONE,2. The tweet does NOT expresses opinion about the target but it HAS opinion about something or someone other than the target.,neg,1237474957963210755
Can anyone imagine a society without good school and good schools without excellent educators,school_closures,NONE,"1.  The tweet explicitly expresses opinion about the target, a part of the target, or an aspect of the target.",pos,1287347320929923072
@SWAtlasHoover when you say “use critical thinking and logic” liberals heads explode. :rolling_on_the_floor_laughing::rolling_on_the_floor_laughing::rolling_on_the_floor_laughing: #COVID19,school_closures,NONE,2. The tweet does NOT expresses opinion about the target but it HAS opinion about something or someone other than the target.,neg,1283412467868028928
Coronavirus has me refreshing Twitter like I'm waiting for a snow day smy,school_closures,NONE,"3.  The tweet is not explicitly expressing opinion. (For example, the tweet is simply giving information.)",pos,1237529249856159745
"Government Schools - No fees, No education, No willingness of parents to admit students in Government schools, Salary of Government teachers - FULL.

Private Schools - Fees, education, Wants admission. Salary of Private Teachers - ONLY GOD KNOWS!",school_closures,NONE,2. The tweet does NOT expresses opinion about the target but it HAS opinion about something or someone other than the target.,neg,1287346927894269953
@ABC This should tell you something parents! #SchoolReopening,school_closures,NONE,"1.  The tweet explicitly expresses opinion about the target, a part of the target, or an aspect of the target.",other,1285050991960883200
"If government has problem with private schools, why central government is privatising sole of its companies? It is because privatization brings decipline and efficiency in system. If government wants to earn money, why not schools?",school_closures,NONE,2. The tweet does NOT expresses opinion about the target but it HAS opinion about something or someone other than the target.,neg,1287365504336764929
"The order, even if aimed at populism, is ill informed and ill thought out. It does not help anyone. It just perpetuates the inevitable collapse of hundreds and possibly thousands of schools in the coming months. #SaveOurSchools #education @imBhupendrasinh @CMOGuj",school_closures,NONE,2. The tweet does NOT expresses opinion about the target but it HAS opinion about something or someone other than the target.,neg,1287352014230286336
Finally something good from the coronavirus:,school_closures,NONE,"3.  The tweet is not explicitly expressing opinion. (For example, the tweet is simply giving information.)",pos,1237504444406865925
"Kindly be little concerned for our unsung heroes who are none other than our teachers. Without them there is no future of our kids. Pay fees ,save teachers save schools.",school_closures,NONE,2. The tweet does NOT expresses opinion about the target but it HAS opinion about something or someone other than the target.,pos,1287342145200771073
"“At the same time, one of the few things we know about the coronavirus with any degree of certainty is that the risk of contracting it diminishes outside — a review of 7,000 cases in China recorded only one instance of fresh-air transmission.” #OpenFCPS",school_closures,NONE,2. The tweet does NOT expresses opinion about the target but it HAS opinion about something or someone other than the target.,pos,1285431769840472064
The very same leaners are going around the streets and our communities without Masks. I just came back from the shop's and no-one is wearing a mask in my community. Government must just make the  unemployed youth  ambassadors for Covid-19.,school_closures,NONE,2. The tweet does NOT expresses opinion about the target but it HAS opinion about something or someone other than the target.,neg,1283359461759954950
"Quote of the day:

Take comfort and shelter under the wings of the Lord.

#COVIDー19 
#coronavirus",school_closures,NONE,"3.  The tweet is not explicitly expressing opinion. (For example, the tweet is simply giving information.)",pos,1239009980919033857
"As the mainstream media also continues to side-step this issue, one has to understand that this is not just about helping private schools owners.",school_closures,NONE,2. The tweet does NOT expresses opinion about the target but it HAS opinion about something or someone other than the target.,other,1284809373932490754
Politicians and bureaucrats who keep calling private schools for admissions and do what not to get a seat should be reminded that your kids don’t go to Govt schools but come to us for quality education. Don’t kill the goose which lays golden eggs for you all.,school_closures,NONE,2. The tweet does NOT expresses opinion about the target but it HAS opinion about something or someone other than the target.,neg,1287341926807552001
"@PMOIndia @HRDMinistry
@imBhupendrasinh @narendramodi
Is Digital India not our PM's dream, then why so many conditions on digital education.
Clearly the govt is not equipped to provide online education, why obstruct pvt schools..",school_closures,NONE,2. The tweet does NOT expresses opinion about the target but it HAS opinion about something or someone other than the target.,neg,1287317506919550977
To prevent #Economiccollapse  #economiccrisis during #CoronavirusPandemic govt shud get banks 2help biz’s by postponing EMI’s n giving discounts in interest charged. Dis small step wud ensure businesses keep paying salaries #COVID #coronavirusinindia #Coronavid19,school_closures,NONE,2. The tweet does NOT expresses opinion about the target but it HAS opinion about something or someone other than the target.,pos,1239034618050801664
@MmusiMaimane if you want something to be done in this country... Get the taxis behind you.,school_closures,NONE,2. The tweet does NOT expresses opinion about the target but it HAS opinion about something or someone other than the target.,pos,1282781040667500548
The moment I saw the press conference live streaming to reopen schools I was thinking,school_closures,NONE,"1.  The tweet explicitly expresses opinion about the target, a part of the target, or an aspect of the target.",other,1283858462733000704
"You know you live in the United States when the higher educations get to close in midst of the coronavirus outbreak, but not the lower educations! :thinking_face:",school_closures,NONE,2. The tweet does NOT expresses opinion about the target but it HAS opinion about something or someone other than the target.,neg,1237529010164224005
"If government school teachers are being paid full salary then why is this discrimination being done with private schools? Why the order of ban on fees thus no renumeration for educators? 
Very sad  but true .",school_closures,NONE,2. The tweet does NOT expresses opinion about the target but it HAS opinion about something or someone other than the target.,neg,1287356643013881856
“If private schools don’t survive this pandemic then the country will go back 50 years. Let that thought sync in your minds @CMOGuj @BJP4Gujarat @vijayrupanibjp. @PMOIndia  @narendramodi @aajtak @imBhupendrasinh @ABPNews Don’t let the school sink...,school_closures,NONE,2. The tweet does NOT expresses opinion about the target but it HAS opinion about something or someone other than the target.,neg,1287353130649128961
People misunderstand schools as non profit organization they are also buissnesses and certainly self financed makong them vulnerable to impraatic decisions of no fees. I,school_closures,NONE,"1.  The tweet explicitly expresses opinion about the target, a part of the target, or an aspect of the target.",other,1287344389111427072
"Good morning 25 years old people. How are those 5 year plans coming along? Is the house set, is the car bought, oh how about settling down? Is it all done or we can explain?
#WhatsApp #COVID19 #MonateBreakfastShow #SADTU",school_closures,NONE,2. The tweet does NOT expresses opinion about the target but it HAS opinion about something or someone other than the target.,neg,1283279286519160832
"@thehill Oh good gracious, just fuck off already #Fauci . You have been punishingly wrong about #COVID19 time and time again. Have some dignity and dummy up about a virus that has a 99% survival. Pandemic my fuzzy ass. #COVID_19 #coronavaccine #ChinaVirus #ReOpenAmerica",school_closures,NONE,2. The tweet does NOT expresses opinion about the target but it HAS opinion about something or someone other than the target.,neg,1282835206362116097
"If you don’t see martial law coming &amp; canceling our election, you must look ahead.We cannot exercise our 1st Amendment Rights to protest police brutality with this maniac in a red tie in office. Every other country can; even Russia! #TrumpLiesAmericansDie",school_closures,NONE,2. The tweet does NOT expresses opinion about the target but it HAS opinion about something or someone other than the target.,neg,1287541458543747074
So grateful to be entering my 13th year of homeschooling.,school_closures,NONE,2. The tweet does NOT expresses opinion about the target but it HAS opinion about something or someone other than the target.,pos,1283808671189938176
"Did I tell you that the number of new deaths in Pima county the county where Tucson is located the second largest city in Arizona.  Had ZERO deaths reported for coronavirus again today.   

Zero

#CoronaVirus #COVID__19 #ArizonaCovid19",school_closures,NONE,2. The tweet does NOT expresses opinion about the target but it HAS opinion about something or someone other than the target.,pos,1281728948104081409
@KirinDave @brianreagan7 @TrumpWarRoom @CBSNews Did you miss the stories just yesterday of 33 Florida labs caught exaggerating positive Chinese coronavirus results by a factor of ten. How many other labs across the country are doing the same.,school_closures,NONE,2. The tweet does NOT expresses opinion about the target but it HAS opinion about something or someone other than the target.,neg,1283954066213789696
"Okay here’s the plan, I found out you can get paid $1100 to test the first potential coronavirus vaccine. So who’s finna take one for the team?:eyes:",school_closures,NONE,"3.  The tweet is not explicitly expressing opinion. (For example, the tweet is simply giving information.)",neg,1237635437159526400
"In regard to this, the Gujarat Government decided that parents did not have to pay fees and that term fees paid so far since the lockdown be refunded by schools to parents. This decision come as an extremely insensitive and dangerous step.",school_closures,NONE,"1.  The tweet explicitly expresses opinion about the target, a part of the target, or an aspect of the target.",neg,1287364250168483840
I have a joke on Indian Education System but Private Schools won't get it.,school_closures,NONE,2. The tweet does NOT expresses opinion about the target but it HAS opinion about something or someone other than the target.,neg,1287357886604013568
"While schools planned to keep learning going for children, little did they know govt was working on cutting them from the source. 
Whose intention do we trust here? 
Choose your side wisely parents, it’s about your kid’s future, not temporary evasion of expense!",school_closures,NONE,2. The tweet does NOT expresses opinion about the target but it HAS opinion about something or someone other than the target.,neg,1287354227203874817
The only positive thing about the coronavirus is that my school finally ends up replacing the soap and hand sanitizer every day now instead of once or twice a week,school_closures,NONE,2. The tweet does NOT expresses opinion about the target but it HAS opinion about something or someone other than the target.,other,1239786845644279809
Focus of government has shifted from fight against Corona to fight against private schools.,school_closures,NONE,"1.  The tweet explicitly expresses opinion about the target, a part of the target, or an aspect of the target.",neg,1287318030431604742
@janemarielynch @RepSwalwell If masks work so well,school_closures,NONE,2. The tweet does NOT expresses opinion about the target but it HAS opinion about something or someone other than the target.,neg,1283446295366193152
Schools are doing their best to ensure that  education for children is not disrupted. I support my children's school and all self financed schools wholeheartedly.,school_closures,NONE,2. The tweet does NOT expresses opinion about the target but it HAS opinion about something or someone other than the target.,pos,1287366745850707968
"@realDonaldTrump Deflecting any way you can so people don't notice that over 138,000 Americans have died because you have failed to do anything during this pandemic except useless, nonsense tweeping. #EnemyOfThePeople #TrumpVirus #TrumpIsKillingUs",school_closures,NONE,2. The tweet does NOT expresses opinion about the target but it HAS opinion about something or someone other than the target.,neg,1284431596901273600
"Why does ut matteruf schools get defudnded if they dont open. 1. If they aren't open they arent gonna be spending money on shit anyway. 2. People don't learn anything at s hool anyway either, except how to cheat and lie. They can look up shit on their phones. ",school_closures,NONE,"1.  The tweet explicitly expresses opinion about the target, a part of the target, or an aspect of the target.",neg,1282708399868837891
"After issuing tenders for sanitizing schools and provision of PPE, water tanks, and sanitizers.looting:thinking_face:",school_closures,NONE,2. The tweet does NOT expresses opinion about the target but it HAS opinion about something or someone other than the target.,other,1283343707635363840
"""If you want to see the poor remain poor, generation after generation, just keep the standards low in their schools and make excuses for their academic shortcomings and personal behavior. But please don't congratulate yourself on your compassion."" -Thomas Sowell",school_closures,NONE,2. The tweet does NOT expresses opinion about the target but it HAS opinion about something or someone other than the target.,neg,1281221896722427905
The plight of these schools and their staff members must be heard and resolved by the government.,school_closures,NONE,"1.  The tweet explicitly expresses opinion about the target, a part of the target, or an aspect of the target.",neg,1284809931863072768
We actually have to Stan the University of Liverpool. Glad I put them as my firm #coronavirus,school_closures,NONE,2. The tweet does NOT expresses opinion about the target but it HAS opinion about something or someone other than the target.,pos,1238910017715175424
I Personally Feel Like Schools Should Be Mispromistimanilatigated Right Now!!!!!!!,school_closures,NONE,"1.  The tweet explicitly expresses opinion about the target, a part of the target, or an aspect of the target.",pos,1283332404313296896
@IngrahamAngle I’m ok with a mask if it makes people safer.,school_closures,NONE,2. The tweet does NOT expresses opinion about the target but it HAS opinion about something or someone other than the target.,pos,1284082596683620352
Thanks :flag_for_China: for knowingly withholding the :microbe:#KAG #Wuhan #ChinaVirus #Kungflu,school_closures,NONE,2. The tweet does NOT expresses opinion about the target but it HAS opinion about something or someone other than the target.,neg,1283961902394114053
"@Debber66 @DineshDSouza The #COVID19 is intelligent and will not dare to reproduce here!
#FauciLiedPeopleDied",school_closures,NONE,2. The tweet does NOT expresses opinion about the target but it HAS opinion about something or someone other than the target.,neg,1280870359345102850
"If schools aren't going to open this year, can I get a refund on those school taxes I paid??",school_closures,NONE,2. The tweet does NOT expresses opinion about the target but it HAS opinion about something or someone other than the target.,neg,1286487233789231106
Has anyone in #SouthAfrica got any updates on the closing of schools? Has the @DBE_SA said anything yet?,school_closures,NONE,"3.  The tweet is not explicitly expressing opinion. (For example, the tweet is simply giving information.)",other,1285837316154687490
"Now there’s two more reported Coronavirus cases in my county. Literally everyone at my school talks about the Coronavirus and how our school is going to close and such, but at this point, I think that may happen and I will be taking online courses.",school_closures,NONE,"1.  The tweet explicitly expresses opinion about the target, a part of the target, or an aspect of the target.",other,1237814133996826624
